Name,Description,Category
Problem,I could really use a smaller _____!,Karobari
Problem,I wish _____ were more fun!,Karobari
Problem,I would like to support _____!,Karobari
Problem,I would like to know when _____ happens!,Karobari
Problem,I want people to know about my _____!,Karobari
Problem,I keep ruining _____!,Karobari
Problem,I’ve always wanted to explore _____!,Karobari
Problem,I’m tired of getting _____ every single day!,Karobari
Problem,I wish I was more _____!,Karobari
Problem,I keep getting _____ on me!,Karobari
Problem,I am not looking forward to _____!,Karobari
Problem,_____ just doesn’t satisfy me anymore!,Karobari
Problem,I’m tired of people borrowing my _____!,Karobari
Problem,I never know what to buy for _____!,Karobari
Problem,I keep getting interrupted when I _____!,Karobari
Problem,I require a very fancy _____!,Karobari
Problem,There’s a real risk I might _____!,Karobari
Problem,I never know how much to _____!,Karobari
Problem,I can’t hold on to _____!,Karobari
Problem,"I need to change _____, now!",Karobari
Problem,I can’t stand how slow _____ is!,Karobari
Problem,People are always staring at my _____!,Karobari
Problem,I miss the good ol’ days of _____!,Karobari
Problem,My _____ leaks!,Karobari
Problem,I want to be the first person to _____!,Karobari
Problem,I wish I had the energy to _____!,Karobari
Problem,My spouse keeps forgetting my _____!,Karobari
Problem,I need a place just for my _____!,Karobari
Problem,I need to organize _____!,Karobari
Problem,I think my parents might be getting _____!,Karobari
Problem,_____ is just too crowded.,Karobari
Problem,There’s never enough time to _____!,Karobari
Problem,I hate getting older because of _____!,Karobari
Problem,My job needs more _____!,Karobari
Problem,I always forget _____ when I travel!,Karobari
Problem,I’m only happy when I _____!,Karobari
Problem,I get so sleepy when I have to _____!,Karobari
Problem,"When I get angry, I _____!!!",Karobari
Problem,My house always smells like _____!,Karobari
Problem,Wild animals keep eating my _____!,Karobari
Problem,My vacations are always ruined by _____!,Karobari
Problem,I want to get in shape while I _____!,Karobari
Problem,I regret that I never _____!,Karobari
Problem,_____ always make me cry!,Karobari
Problem,I’m worried I’m not prepared for _____!,Karobari
Problem,I want to safely _____!,Karobari
Problem,I want to help the environment while I _____!,Karobari
Problem,I have trouble climbing _____!,Karobari
Problem,I need to defend myself from _____!,Karobari
Problem,"When I speak in public, I _____.",Karobari
Problem,I’m tired of having my son explain _____ to me!,Karobari
Problem,I hate rishta hunting because of _____!,Karobari
Problem,I don’t invite people over because of _____!,Karobari
Problem,I need a way to get out of _____!,Karobari
Problem,I wish my kids would _____!,Karobari
Problem,"As I get older, I need more _____!",Karobari
Problem,I can’t sleep without _____!,Karobari
Problem,Constant _____ is stressing me out!,Karobari
Problem,I dread the holidays because of _____!,Karobari
Problem,I don’t enjoy _____ anymore!,Karobari
Problem,I mess up my job interviews when I _____!,Karobari
Problem,I can’t get _____ out of my clothes!,Karobari
Problem,I want to _____ like I used to!,Karobari
Problem,I’m tired of my spouse taking my _____!,Karobari
Problem,I just want to _____ all day!,Karobari
Problem,I waste too much time _____!,Karobari
Problem,I’m scared to start _____!,Karobari
Problem,I’m dissatisfied with the quality of _____.,Karobari
Problem,I have a terrible relationship with _____!,Karobari
Problem,I have to get up in the middle of the night to _____!,Karobari
Problem,I’m disgusted by _____.,Karobari
Problem,I’m angry about _____!,Karobari
Problem,I’m too tired to _____!,Karobari
Problem,_____ happens too frequently.,Karobari
Problem,I am obsessed with _____!,Karobari
Problem,I think _____ is just too dangerous!,Karobari
Problem,I want to walk and _____ at the same time!,Karobari
Problem,I can never find a good _____!,Karobari
Problem,All I do is work on my _____!,Karobari
Problem,"I’m due in court, but I have a _____!",Karobari
Problem,_____ is too cold!,Karobari
Problem,I’m tired of endless _____!,Karobari
Problem,There’s always a _____ outside my window!,Karobari
Problem,I really need access to _____!,Karobari
Problem,I wish I knew more about _____!,Karobari
Problem,I hate that everyone calls me _____!,Karobari
Problem,I want to be in the _____ Hall of Fame!,Karobari
Problem,I love having a pool but I hate _____!,Karobari
Problem,My lunch break is always interrupted by _____!,Karobari
Problem,I worry about running into _____ in a dark alley!,Karobari
Problem,I’m scared of finding _____ in my basement!,Karobari
Problem,My cat won’t stop _____!,Karobari
Problem,I always _____ at weddings!,Karobari
Problem,I always get hungry while I _____!,Karobari
Problem,I wish I could reuse _____!,Karobari
Problem,I hate shopping because of _____!,Karobari
Problem,I can’t stop thinking about _____!,Karobari
Problem,My family needs more _____!,Karobari
Problem,Nothing embarrasses me more than _____!,Karobari
Problem,I want to drive and _____ at the same time!,Karobari
Problem,I can’t sleep because of _____!,Karobari
Problem,I don’t trust _____!,Karobari
Problem,I have too many _____!,Karobari
Problem,I wish I could meet _____!,Karobari
Problem,"I need to get _____, fast!",Karobari
Problem,I have too many _____ lying around my house!,Karobari
Problem,The worst part of work is _____!,Karobari
Problem,I can’t relax because of _____!,Karobari
Problem,I wish I knew what it was like to _____!,Karobari
Problem,I’m tired of hearing about _____!,Karobari
Problem,I’m always attracting _____!,Karobari
Problem,I’m constantly cleaning my _____!,Karobari
Problem,I would love to _____ like a professional!,Karobari
Problem,I want to live like _____!,Karobari
Problem,I wish I could get my _____ back!,Karobari
Problem,The worst part of winter is _____!!!,Karobari
Problem,I find _____ to be incredibly dangerous!,Karobari
Problem,My biggest fear is _____!,Karobari
Problem,It’s embarrassing to be on a date and not have _____!,Karobari
Problem,I hate going camping because of _____!,Karobari
Problem,I annoy people when I _____!,Karobari
Problem,I’m always losing my _____!,Karobari
Problem,I’m tired of not being able to _____!,Karobari
Problem,"In five years, we’ll all say “We should’ve stopped _____.”",Karobari
Problem,There’s gotta be a way to make _____ less boring!,Karobari
Problem,I would get more work done if I didn’t have to _____!,Karobari
Problem,My garden is infested with _____!,Karobari
Problem,They won’t let me take my _____ on airplanes!,Karobari
Problem,My kids won’t leave _____ alone!,Karobari
Problem,My baby needs to learn to _____!,Karobari
Problem,I want to make my own _____!,Karobari
Problem,Why can’t _____ be cheaper?!,Karobari
Problem,I hate to fly because of _____.,Karobari
Problem,_____ keeps me from working out!,Karobari
Problem,I find _____ to be straight-up confusing.,Karobari
Problem,I’m always tired because I _____!,Karobari
Problem,I want to always have _____ with me!,Karobari
Problem,I need more _____ in my diet.,Karobari
Problem,"Every time I turn on the tv, I see _____.",Karobari
Problem,People always ask me for _____.,Karobari
Problem,_____ keep appearing on my doorstep!,Karobari
Problem,I’m always craving _____!,Karobari
Problem,I can never remember my _____.,Karobari
Problem,I’m constantly running from _____.,Karobari
Problem,I find _____ to be very disagreeable.,Karobari
Problem,I absolutely hate the sound of _____.,Karobari
Problem,I wish _____ was more accessible.,Karobari
Problem,_____ terrifies me!,Karobari
Problem,I’m embarrassed to love _____!,Karobari
Problem,I keep getting arrested for _____!,Karobari
Problem,I really miss _____!,Karobari
Problem,My _____ keeps coming back!,Karobari
Problem,I want to _____ with my family!,Karobari
Problem,I can never get caught up on _____!,Karobari
Problem,I wish I knew what is was like to be _____.,Karobari
Problem,I hate waiting more than five minutes for _____!,Karobari
Problem,I wish I could always be in _____!,Karobari
Problem,I hate to eat _____!,Karobari
Problem,I want to learn more about _____!,Karobari
Problem,I want to see more _____!,Karobari
Problem,_____ are too tall!,Karobari
Problem,I don’t look good in _____!,Karobari
Problem,I never have a _____ when I need one!,Karobari
Problem,Whenever I throw a party _____ shows up!,Karobari
Problem,I hate going to _____!,Karobari
Problem,My friends are too busy with their _____!,Karobari
Problem,"Everywhere I look, I see _____!",Karobari
Problem,I don’t like amusement parks because of _____!,Karobari
Problem,I have a hard time finding _____!,Karobari
Problem,I want everyone to see _____!,Karobari
Problem,I want to cover up _____!,Karobari
Problem,I need a way to cheat _____!,Karobari
Problem,I’m afraid of choking on _____!,Karobari
Problem,I don’t want to think about _____ again!,Karobari
Problem,I hate the taste of _____!,Karobari
Problem,My coworkers never _____!,Karobari
Problem,I suspect my neighbor is _____!,Karobari
Problem,I cracked my _____!,Karobari
Problem,I need a more powerful _____!,Karobari
Problem,I hate _____ by myself!,Karobari
Problem,Nobody will _____ me anymore!,Karobari
Problem,I have a hard time keeping _____!,Karobari
Problem,"I spilled _____, everywhere!",Karobari
Problem,I want to know about the latest _____!,Karobari
Problem,My relatives left a bunch of _____ at my house!,Karobari
Problem,There’s a hole in my _____!,Karobari
Problem,I can’t avoid _____!,Karobari
Problem,I keep putting off _____!,Karobari
Problem,My _____ grows too fast!,Karobari
Problem,I can’t see _____!,Karobari
Problem,I’m always getting stuck with _____!,Karobari
Problem,I want to impress people with _____!,Karobari
Problem,My _____ keeps getting wet!,Karobari
Problem,I can’t quite reach _____!,Karobari
Problem,I’m having a hard time grasping _____!,Karobari
Problem,I want to get slowly involved in _____,Karobari
Problem,I wish everyone would _____!,Karobari
Problem,I need a way to measure _____!,Karobari
Problem,I want to pay tribute to _____.,Karobari
Problem,I seriously need to reduce my _____!,Karobari
Problem,All I want is to be _____!,Karobari
Problem,I need to catch _____!,Karobari
Problem,I want to prove _____!,Karobari
Problem,I wish I could _____ faster!,Karobari
Problem,I hate it when my _____ smells!,Karobari
Problem,I’ll scream if I have to _____ again!,Karobari
Problem,I’m always sore because I _____ too much!,Karobari
Problem,I get grossed out by _____!,Karobari
Problem,I’m way too old to _____!,Karobari
Problem,People tell me I _____ too much!,Karobari
Problem,I don’t want to _____ anymore!,Karobari
Problem,I hate talking during _____!,Karobari
Problem,My _____ is gonna kill me one of these days!,Karobari
Problem,I hate having to _____ in the morning!,Karobari
Problem,People keep giving me _____!,Karobari
Problem,I need an easier _____!,Karobari
Problem,It’s getting harder and harder to find _____!,Karobari
Problem,I’ve Humsafar three jobs because I _____!,Karobari
Problem,I wish I were more comfortable _____!,Karobari
Problem,I’m trying to quit _____!,Karobari
Problem,I’m always sad after _____!,Karobari
Problem,I have no social life because of _____!,Karobari
Problem,I can't eat biryani without _____!,Karobari
Problem,Load shedding always happens when I _____!,Karobari
Problem,My ammi always scolds me for _____!,Karobari
Problem,I need a way to spot _____ at weddings!,Karobari
Problem,Traffic is terrible because of _____!,Karobari
Problem,I wish I could bargain for _____!,Karobari
Problem,I need a robot to handle my _____!,Karobari
Problem,Rishta aunties are obsessed with _____!,Karobari
Problem,I can't survive the summer without _____!,Karobari
Problem,I need an invention to hide my _____ from guests!,Karobari
Problem,My tailor always ruins my _____!,Karobari
Problem,I wish there was an app for _____!,Karobari
Problem,I need a way to smuggle _____ into the house!,Karobari
Problem,Desi parents never understand _____!,Karobari
Problem,I need a fast lane for _____!,Karobari
Problem,I wish I could filter out _____ from my life!,Karobari
Problem,I need a mute button for _____!,Karobari
Problem,I want to automate _____!,Karobari
Problem,My life would be perfect if I could just _____!,Karobari
Problem,I can never find a matching _____!,Karobari
Problem,I need a safer way to eat _____!,Karobari
Problem,My chai is always too _____!,Karobari
Problem,I wish I could carry _____ in my pocket!,Karobari
Problem,I need a waterproof _____!,Karobari
Problem,I'm tired of untangling my _____!,Karobari
Problem,I need a silent _____!,Karobari
Problem,I wish my phone could _____!,Karobari
Problem,I need a device to find my _____!,Karobari
Problem,I want to instantly clean my _____!,Karobari
Problem,I need a lock for my _____!,Karobari
Problem,I wish I could skip _____ at family gatherings!,Karobari
Problem,My chappals always break when I _____!,Karobari
Problem,I need a way to protect my _____ from the smog!,Karobari
Problem,Rickshaw drivers always overcharge for _____!,Karobari
Problem,I can't believe my phuppo said _____!,Karobari
Problem,My wifi only works when I _____!,Karobari
Problem,I need an alarm clock that feels like _____!,Karobari
Problem,I wish I could eat _____ without gaining weight!,Karobari
Problem,My laundry pile looks like a _____!,Karobari
Problem,I need a drone to deliver my _____!,Karobari
Problem,I wish my car could fly over _____!,Karobari
Problem,The shopkeeper refused to return my _____!,Karobari
Problem,I need a secret compartment for my _____!,Karobari
Problem,My boss always calls when I'm _____!,Karobari
Problem,I wish I could teleport away from _____!,Karobari
Problem,I need a universal remote for _____!,Karobari
Problem,My neighbor's kid keeps stealing my _____!,Karobari
Problem,I wish I could pause time to _____!,Karobari
Problem,I need a robot that can make perfect _____!,Karobari
Problem,My phone battery dies whenever I _____!,Karobari
Problem,I wish I could mute my _____!,Karobari
Problem,I need a self-cleaning _____!,Karobari
Problem,My bank account cries when I _____!,Karobari
Problem,I wish I could trade my _____ for a pizza!,Karobari
Problem,I need a pocket-sized _____!,Karobari
Problem,My haircut looks like a _____!,Karobari
Problem,I wish I could speed up _____!,Karobari
Problem,I need a translator for my _____!,Karobari
Problem,My shoes always smell like _____!,Karobari
Problem,I wish I could invisible-cloak my _____!,Karobari
Problem,I need a GPS tracker for my _____!,Karobari
Problem,My tea gets cold when I _____!,Karobari
Problem,I wish I could download _____ directly to my brain!,Karobari
Problem,I need a machine that folds _____!,Karobari
Problem,My umbrella always flips inside out during _____!,Karobari
Problem,I wish I could unsubscribe from _____!,Karobari
Problem,I need a smart mirror that tells me _____!,Karobari
Problem,My socks always disappear in the _____!,Karobari
Problem,I wish I could pay for things with _____!,Karobari
Problem,I need a device that detects _____!,Karobari
Problem,My brain freezes when I see _____!,Karobari
Problem,I wish I could Ctrl+Z my _____!,Karobari
Problem,I need a shield against _____!,Karobari
Problem,My pillow is never cool enough for _____!,Karobari
Problem,I wish I could block _____ in real life!,Karobari
Problem,I need a lie detector for my _____!,Karobari
Problem,My cat judges me for _____!,Karobari
Problem,I wish I could summon _____ with a snap!,Karobari
Problem,I need a portable _____!,Karobari
Problem,My weekends are ruined by _____!,Karobari
Problem,I wish I could duplicate my _____!,Karobari
Problem,I need a stain remover for my _____!,Karobari
Problem,My leftovers always taste like _____!,Karobari
Problem,I wish I could delete _____ from my memory!,Karobari
Problem,I need a password manager for my _____!,Karobari
Problem,My alarm clock sounds like a _____!,Karobari
Problem,I wish I could customize my _____!,Karobari
Problem,I need a filter for _____!,Karobari
Problem,My wallet is allergic to _____!,Karobari
Problem,I wish I could upgrade my _____!,Karobari
Problem,I need a turbo button for _____!,Karobari
Problem,My mood depends on _____!,Karobari
Problem,I wish I could send _____ to space!,Karobari
Problem,I need a refund for my _____!,Karobari
Problem,My shadow looks like a _____!,Karobari
Problem,I wish I could fast forward through _____!,Karobari
Problem,I need a backup plan for _____!,Karobari
Problem,My dream job involves _____!,Karobari
Problem,I wish I could re-roll my _____!,Karobari
Problem,I need a tutorial for _____!,Karobari
Problem,My handwriting looks like _____!,Karobari
Problem,I wish I could auto-correct my _____!,Karobari
Problem,I need a magnifying glass for _____!,Karobari
Problem,My patience runs out when _____!,Karobari
Problem,I wish I could swap lives with _____!,Karobari
Problem,I need a safety net for _____!,Karobari
Problem,My reflection shows me _____!,Karobari
Problem,I wish I could freeze _____!,Karobari
Problem,I need a mute button for my _____!,Karobari
Problem,My secrets are safe with _____!,Karobari
Problem,I wish I could google my _____!,Karobari
Problem,I need a hashtag for _____!,Karobari
Problem,My playlist is full of _____!,Karobari
Problem,I wish I could retweet my _____!,Karobari
Problem,I need a charger for my _____!,Karobari
Problem,My inbox is flooding with _____!,Karobari
Problem,I wish I could unfollow _____!,Karobari
Problem,I need a status update for _____!,Karobari
Problem,My profile picture needs more _____!,Karobari
Problem,I wish I could like my own _____!,Karobari
Problem,I need a notification for _____!,Karobari
Problem,My timeline is clogged with _____!,Karobari
Problem,I wish I could share _____!,Karobari
Problem,I need a direct message from _____!,Karobari
Problem,My followers want more _____!,Karobari
Problem,I wish I could trend for _____!,Karobari
Problem,I need a verified badge for _____!,Karobari
Problem,My bio says I love _____!,Karobari
Problem,I wish I could live stream my _____!,Karobari
Problem,I need a filter that hides _____!,Karobari
