Name,Category,Type
"What was your first record, tape or CD that you ever owned?",More Fun Questions,Question
What were words you couldn't pronounce as a child?,More Fun Questions,Question
Have you ever gotten super lost? What happened?,More Fun Questions,Question
What's the story of your first crush?,More Fun Questions,Question
What was your first job? What did you like/dislike about it?,More Fun Questions,Question
Who was the worst grade-school teacher you ever had?,More Fun Questions,Question
"What afterschool activity did you quit as a kid, and why?",More Fun Questions,Question
What's the funniest thing that ever happened on your family vacation?,More Fun Questions,Question
What's the funniest animal you've ever owned as a pet?,More Fun Questions,Question
What's the worst haircut you ever had?,More Fun Questions,Question
What's the best prank you've ever played on someone?,More Fun Questions,Question
What's the most ridiculous thing your parents ever did to embarrass you?,More Fun Questions,Question
"As a kid, did you ever do something wrong but manage to pin it on your siblings?",More Fun Questions,Question
What's the worst job you've ever had?,More Fun Questions,Question
What totally rad expression did you overuse in high school?,More Fun Questions,Question
Who is your craziest/most interesting relative?,More Fun Questions,Question
What band would you be embarrassed to admit you listen to?,More Fun Questions,Question
What's the craziest thing on your bucket list?,More Fun Questions,Question
What's a weird fact you happen to know?,More Fun Questions,Question
"What is your real favorite movie, and what movie do you pretend is your favorite?",More Fun Questions,Question
What's your strangest talent?,More Fun Questions,Question
What's your funniest talent? Or un-talent?,More Fun Questions,Question
What's your best idea for a reality TV show?,More Fun Questions,Question
Which Disney character's story does your life most resemble?,More Fun Questions,Question
Everyone has those recurring bad dreams … what is your nightmare?,More Fun Questions,Question
What are two truths and a lie about you?,More Fun Questions,Question
What's a funny (appropriate) pick-up line that works for you?,More Fun Questions,Question
What's your favorite part of a fair or carnival?,More Fun Questions,Question
What show on Netflix did you binge watch embarrassingly fast?,More Fun Questions,Question
Which celebrity do you shamelessly follow in the news?,More Fun Questions,Question
What's something about you that people would be surprised to know?,More Fun Questions,Question
What is your favorite smell and why?,More Fun Questions,Question
